{
  "$schema": "https://json-schema.org/draft/2020-12/schema",
  "$id": "https://hero.dev/contracts/attention/v1/action-result.schema.json",
  "title": "ActionResult",
  "type": "object",
  "required": ["schema_version"],
  "properties": {
    "schema_version": {"const": 1},
    "row": {"type": "object"},
    "removed_row_id": {"type": "string"},
    "snapshot_revision": {"type": "string"},
    "source": {},
    "navigation": {"type": "object"},
    "launch": {"type": "object"},
    "error": {"type": "object", "required": ["code", "message"], "properties": {"code": {"enum": ["validation", "stale", "unsupported", "missing", "incompatible_version", "unavailable", "idempotency_conflict", "permission"]}, "message": {"type": "string"}, "field": {"type": "string"}, "details": {"type": "object"}}}
  },
  "anyOf": [
    {"required": ["error"]},
    {"anyOf": [{"required": ["row"]}, {"required": ["removed_row_id"]}, {"required": ["source"]}, {"required": ["navigation"]}, {"required": ["launch"]}]}
  ]
}
