{"schema_version":1,"row":{"schema_version":1,"id":"focus:focus_1","source_kind":"focus","source_id":"focus_1","project":{"peer_id":"peer_hero","display_name":"Hero"},"title":"Launch","timestamp":"2026-07-22T18:00:00Z","revision":3},"snapshot_revision":"after-launch","source":{"id":"focus_1","revision":3},"launch":{"project":{"peer_id":"peer_hero","display_name":"Hero"},"prompt":"Continue the work."}}
