{"schema_version":1,"row":{"schema_version":1,"id":"focus:focus_01JYX","source_kind":"focus","source_id":"focus_01JYX","project":{"peer_id":"peer_hero","display_name":"Hero"},"title":"Finish inbox contracts","timestamp":"2026-07-22T18:02:00Z","revision":4},"snapshot_revision":"snapshot_43","source":{"id":"focus_01JYX","revision":4},"launch":{"project":{"peer_id":"peer_hero","display_name":"Hero"},"prompt":"Continue the durable attention initiative."}}
